{
  "schemaVersion": 1,
  "requireDeclared": true,
  "allowed": [
    "0BSD",
    "Apache-2.0",
    "BSD-2-Clause",
    "BSD-3-Clause",
    "ISC",
    "MIT",
    "MPL-2.0"
  ],
  "denied": [
    "NOASSERTION",
    "Proprietary",
    "SEE LICENSE IN LICENSE",
    "UNLICENSED"
  ],
  "overrides": {}
}
